{
  "schema_version": 1,
  "kind": "component_test",
  "name": "wp154a4sureqbfzgc-logic-5",
  "policy": "functional",
  "until": "1us",
  "circuit": {
    "components": [
      {
        "id": "DUT",
        "component": "emblink/wp154a4sureqbfzgc"
      },
      {
        "id": "H",
        "component": "emblink/logic_level",
        "params": {
          "level": 1
        }
      },
      {
        "id": "L",
        "component": "emblink/logic_level",
        "params": {
          "level": 0
        }
      }
    ],
    "nets": {
      "HI": [
        "H.OUT",
        "DUT.R",
        "DUT.B"
      ],
      "LO": [
        "L.OUT",
        "DUT.COM",
        "DUT.G"
      ]
    }
  },
  "expect": {
    "output:DUT.color": {
      "at": "500ns",
      "equals": "#ff00ff"
    }
  }
}
