{
  "schema_version": 1,
  "kind": "component_test",
  "name": "functional-cathode-3",
  "description": "functional cathode 3",
  "policy": "functional",
  "until": "1us",
  "circuit": {
    "components": [
      {
        "id": "H",
        "component": "emblink/logic_level",
        "params": {
          "level": 1
        }
      },
      {
        "id": "L",
        "component": "emblink/logic_level",
        "params": {
          "level": 0
        }
      },
      {
        "id": "DUT",
        "component": "emblink/rgb_led",
        "params": {
          "common": "cathode"
        }
      }
    ],
    "nets": {
      "HI": [
        "H.OUT",
        "DUT.R",
        "DUT.G"
      ],
      "LO": [
        "L.OUT",
        "DUT.COM",
        "DUT.B"
      ]
    }
  },
  "expect": {
    "output:DUT.color": {
      "at": "500ns",
      "equals": "#ffff00"
    },
    "output:DUT.lit": {
      "at": "500ns",
      "equals": true
    }
  }
}
